{
  "$schema": "../../../references/이미지-에셋-manifest.schema.json",
  "schema_version": "1.0",
  "session": "N주차",
  "image_mode": "pending",
  "slides": [
    {
      "slide_id": "C3-2",
      "part": 4,
      "decision": "IMAGE_EXPLANATORY",
      "decision_reason": "일반명사 PRD와 이 수업의 prd.md를 같은 문서로 오인하기 쉬워, 두꺼운 문서 더미(PRD)와 다섯 칸 얇은 파일(prd.md)의 크기 대비를 비교표 두 열 머리 사이에 두어 구분을 보강한다. 2026-09-11 W2 부활(원본 바이브코딩 2주차 C3-N1·C3-2 병합) — 원본 슬롯의 기존 PNG를 그대로 재사용하며 신규 생성·변형 0장.",
      "purpose": "explanatory",
      "role": "support",
      "brief": {
        "learning_point": "The general concept of a PRD, a thick multi-team planning document, is different from prd.md in this course, a thin file with just five slots to fill.",
        "source_metaphor": "A thick, multi-layered paper stack labeled for many teams, beside one thin single sheet with exactly five small filled slots.",
        "metaphor_mapping": [
          {
            "visual": "a thick, multi-layered paper stack",
            "concept": "the general concept of a PRD used across many teams in organizations"
          },
          {
            "visual": "one thin single sheet with five small filled slots",
            "concept": "prd.md, this course's five-item file read by the Coding Agent"
          },
          {
            "visual": "a clear size contrast between the stack and the sheet",
            "concept": "they are related by name only, not the same document"
          }
        ],
        "must_show": [
          "a thick multi-layered paper stack",
          "one thin sheet with five small filled slots",
          "a clear size contrast between them"
        ],
        "must_not_imply": [
          "that prd.md is an incomplete or lesser version of a real PRD",
          "that organizations always use the thick form"
        ],
        "alt_text": "여러 겹의 두꺼운 요구사항 문서 더미와 다섯 칸으로 정돈된 얇은 파일이 나란히 놓여, 팀이 함께 보는 PRD와 AI가 읽는 prd.md가 서로 다른 문서임을 보여 준다",
        "audience": "코딩 경험이 없거나 AI Coding Agent를 처음 접하는 일반 참가자",
        "components": [
          "thick paper stack",
          "thin single sheet",
          "five small filled slots on the sheet",
          "size-contrast divider"
        ],
        "key_relationship": "comparison"
      },
      "expected_file": "자료/images/s37_prd-concept-vs-prdmd-file-paper-cut-v1-transparent.png",
      "method": "reuse",
      "asset_id": "ASSET-116",
      "parent_asset_ids": [],
      "prompt_id": "P-S37-PRD",
      "status": "ready",
      "qa": {
        "static": "pass",
        "pixel": "pending",
        "visual": "pending",
        "notes": "2026-09-11 W2: 파일 실재와 PNG 1460×846(비율 1.726) 확인 — 덱 슬롯 240×139로 레터박스 없이 배선. ASSET-116은 원본 courses/바이브코딩/sessions/2주차 매니페스트의 ID이고 중앙 레지스트리(kit/images/paper-cut-v1/registry.json)에는 없다. 원본 매니페스트 qa가 pending으로 남아 픽셀·시각 QA 통과 이력은 확인하지 못함 — 메인 렌더 감사에서 판정."
      }
    },
    {
      "slide_id": "N-23",
      "part": 4,
      "decision": "NO_IMAGE",
      "decision_reason": "실제 prd.md 파일 뷰(E-code 계열)와 SVG 괄호 짝짓기가 곧 설명 시각물이다. 이미지를 더하면 파일 내용과 자리를 다툰다(2026-09-11 W2 신설).",
      "purpose": "none",
      "role": "none",
      "brief": {
        "learning_point": null,
        "source_metaphor": null,
        "metaphor_mapping": [],
        "must_show": [],
        "must_not_imply": [],
        "alt_text": null,
        "audience": "코딩 경험이 없거나 AI Coding Agent를 처음 접하는 일반 참가자",
        "components": [],
        "key_relationship": "none"
      },
      "expected_file": null,
      "method": "none",
      "asset_id": null,
      "parent_asset_ids": [],
      "prompt_id": null,
      "status": "not_needed",
      "qa": {
        "static": "not_applicable",
        "pixel": "not_applicable",
        "visual": "not_applicable",
        "notes": "판정 기록만 — 덱에 이미지 슬롯 없음."
      }
    },
    {
      "slide_id": "C5-9",
      "part": 5,
      "decision": "NO_IMAGE",
      "decision_reason": "실습 장은 단계 자체가 본체다. 방법 A/B가 갈라졌다 2단계로 합류하는 SVG 흐름 도식이 절차를 설명하므로 설명 이미지를 넣지 않는다(2026-09-11 W2 개편 · 개편 전에도 이미지 없음).",
      "purpose": "none",
      "role": "none",
      "brief": {
        "learning_point": null,
        "source_metaphor": null,
        "metaphor_mapping": [],
        "must_show": [],
        "must_not_imply": [],
        "alt_text": null,
        "audience": "코딩 경험이 없거나 AI Coding Agent를 처음 접하는 일반 참가자",
        "components": [],
        "key_relationship": "none"
      },
      "expected_file": null,
      "method": "none",
      "asset_id": null,
      "parent_asset_ids": [],
      "prompt_id": null,
      "status": "not_needed",
      "qa": {
        "static": "not_applicable",
        "pixel": "not_applicable",
        "visual": "not_applicable",
        "notes": "판정 기록만 — 덱에 이미지 슬롯 없음."
      }
    },
    {
      "slide_id": "N-24",
      "part": 5,
      "decision": "NO_IMAGE",
      "decision_reason": "캡처 → AI Chat 정리 → 내가 한 줄 수정 → Google Antigravity 저장의 SVG 흐름 도식과 프롬프트 터미널이 본체다. AI Chat 실제 화면 캡처는 계정·도구 버전마다 달라 쓰지 않는다(슬라이드지침 «계정·연동·권한에 따라 달라지는 기능은 선택 시연»)(2026-09-11 W2 신설).",
      "purpose": "none",
      "role": "none",
      "brief": {
        "learning_point": null,
        "source_metaphor": null,
        "metaphor_mapping": [],
        "must_show": [],
        "must_not_imply": [],
        "alt_text": null,
        "audience": "코딩 경험이 없거나 AI Coding Agent를 처음 접하는 일반 참가자",
        "components": [],
        "key_relationship": "none"
      },
      "expected_file": null,
      "method": "none",
      "asset_id": null,
      "parent_asset_ids": [],
      "prompt_id": null,
      "status": "not_needed",
      "qa": {
        "static": "not_applicable",
        "pixel": "not_applicable",
        "visual": "not_applicable",
        "notes": "판정 기록만 — 덱에 이미지 슬롯 없음."
      }
    }
  ]
}
