{
  "$schema": "../../../references/이미지-에셋-manifest.schema.json",
  "schema_version": "1.0",
  "session": "N주차",
  "image_mode": "pending",
  "slides": [
    {
      "slide_id": "DL-1",
      "part": null,
      "decision": "IMAGE_EXPLANATORY",
      "decision_reason": "사용자가 제공한 chatgpt.com/ko-KR/download 화면 캡처. 내려받는 곳과 누를 단추를 보여 준다.",
      "purpose": "explanatory",
      "role": "support",
      "brief": {
        "learning_point": "ChatGPT 데스크톱 앱은 download 주소의 Windows용 다운로드 단추로 받는다",
        "source_metaphor": null,
        "metaphor_mapping": [],
        "must_show": [
          "chatgpt.com/ko-KR/download 주소",
          "Windows용 다운로드 단추"
        ],
        "must_not_imply": [
          "웹 브라우저의 chatgpt.com에서 작업한다"
        ],
        "alt_text": "chatgpt.com/ko-KR/download 주소와 Windows용 다운로드 단추에 빨간 동그라미를 친 ChatGPT 데스크톱 다운로드 화면",
        "audience": "AI 에이전트 실습 워크숍 수강생(설치 단계)",
        "components": [
          "주소창",
          "Windows용 다운로드 단추",
          "빨간 동그라미"
        ],
        "key_relationship": "flow"
      },
      "expected_file": "자료/img/dl1.png",
      "method": "none",
      "asset_id": null,
      "parent_asset_ids": [],
      "prompt_id": null,
      "status": "ready",
      "qa": {
        "static": "pending",
        "pixel": "not_applicable",
        "visual": "pending",
        "notes": "2026-10-25 사용자 제공 캡처를 가로 1400px로 줄여 저장. 빨간 동그라미는 이미지에 그리지 않고 .shot .ring 오버레이로 얹는다."
      }
    },
    {
      "slide_id": "DL-2",
      "part": null,
      "decision": "IMAGE_EXPLANATORY",
      "decision_reason": "사용자가 제공한 Microsoft Store 설치 창 캡처. 앱 이름과 진행 상태를 보여 준다.",
      "purpose": "explanatory",
      "role": "support",
      "brief": {
        "learning_point": "Store 창에서 ChatGPT · OpenAI인지 확인하고 설치가 끝나길 기다린다",
        "source_metaphor": null,
        "metaphor_mapping": [],
        "must_show": [
          "Microsoft Store 창",
          "ChatGPT · OpenAI 앱 이름",
          "업데이트 확인 중 줄"
        ],
        "must_not_imply": [
          "설치가 끝난 상태"
        ],
        "alt_text": "Microsoft Store 창에서 ChatGPT · OpenAI 앱 이름과 업데이트 확인 중 줄에 빨간 동그라미를 친 화면",
        "audience": "AI 에이전트 실습 워크숍 수강생(설치 단계)",
        "components": [
          "Store 창",
          "앱 이름",
          "진행 상태 줄",
          "빨간 동그라미"
        ],
        "key_relationship": "flow"
      },
      "expected_file": "자료/img/dl2.png",
      "method": "none",
      "asset_id": null,
      "parent_asset_ids": [],
      "prompt_id": null,
      "status": "ready",
      "qa": {
        "static": "pending",
        "pixel": "not_applicable",
        "visual": "pending",
        "notes": "2026-10-25 사용자 제공 캡처를 가로 1400px로 줄여 저장. 빨간 동그라미는 이미지에 그리지 않고 .shot .ring 오버레이로 얹는다."
      }
    },
    {
      "slide_id": "DL-3",
      "part": null,
      "decision": "IMAGE_EXPLANATORY",
      "decision_reason": "사용자가 제공한 ChatGPT 앱 첫 화면 캡처. 왼쪽 위 ChatGPT 메뉴(여기서 Codex를 고른다)를 보여 준다.",
      "purpose": "explanatory",
      "role": "support",
      "brief": {
        "learning_point": "설치한 앱의 왼쪽 위 ChatGPT 메뉴에서 Codex를 고른다",
        "source_metaphor": null,
        "metaphor_mapping": [],
        "must_show": [
          "ChatGPT 앱 첫 화면",
          "왼쪽 위 ChatGPT 메뉴(여기서 Codex를 고른다)"
        ],
        "must_not_imply": [
          "웹 브라우저 화면"
        ],
        "alt_text": "설치한 ChatGPT 앱 첫 화면에서 왼쪽 위 ChatGPT 메뉴에 빨간 동그라미를 친 화면. 여기서 Codex를 고른다",
        "audience": "AI 에이전트 실습 워크숍 수강생(설치 단계)",
        "components": [
          "앱 창",
          "ChatGPT 메뉴",
          "빨간 동그라미"
        ],
        "key_relationship": "flow"
      },
      "expected_file": "자료/img/dl3.png",
      "method": "none",
      "asset_id": null,
      "parent_asset_ids": [],
      "prompt_id": null,
      "status": "ready",
      "qa": {
        "static": "pending",
        "pixel": "not_applicable",
        "visual": "pending",
        "notes": "2026-10-25 사용자 제공 캡처를 가로 1400px로 줄여 저장. 빨간 동그라미는 이미지에 그리지 않고 .shot .ring 오버레이로 얹는다."
      }
    },
    {
      "slide_id": "P5-1",
      "part": 5,
      "decision": "IMAGE_EXPLANATORY",
      "decision_reason": "모션그래픽 완성 예시 영상(영상.html)의 세로 장면 세 개를 한 장에 나란히 놓은 합성. 실습 시작 전에 결과물이 어떤 모양인지 보여 준다.",
      "purpose": "explanatory",
      "role": "support",
      "brief": {
        "learning_point": "인터뷰에 답하면 훅 · 숫자 · 행동 안내 장면으로 이뤄진 세로 영상이 나온다",
        "source_metaphor": null,
        "metaphor_mapping": [],
        "must_show": [
          "훅 장면",
          "숫자 장면",
          "행동 안내 장면"
        ],
        "must_not_imply": [
          "답과 상관없이 모두 같은 영상이 나온다"
        ],
        "alt_text": "완성 예시 영상의 세 장면. 훅, 숫자, 행동 안내가 세로 화면으로 나란히 놓여 있다",
        "audience": "AI 에이전트 실습 워크숍 수강생(실습 5 목표 단계)",
        "components": [
          "훅 장면",
          "숫자 장면",
          "행동 안내 장면"
        ],
        "key_relationship": "flow"
      },
      "expected_file": "자료/img/p5.png",
      "method": "none",
      "asset_id": null,
      "parent_asset_ids": [],
      "prompt_id": null,
      "status": "ready",
      "qa": {
        "static": "pending",
        "pixel": "not_applicable",
        "visual": "pending",
        "notes": "2026-10-25 세로 영상 장면 세 개(훅 · 숫자 · 행동)를 1400×874(700×437의 2배)에 나란히 합성해 저장. 어느 장면표 번호를 쓴 합성인지는 확인 필요."
      }
    }
  ]
}
